Component,Feature,Skal flyttes til Github Projects,Flyttekommentar,Flyttet til Github Projects,Usertesting,Done ✔️,V1,V2,V3,Done,Documentation only,Comments
aws account,SSO,,,,x,x,,,,,,
aws account,Configuration change logs,x,,,,,,,,,,wiz.io?
aws account,Guardrails in control tower,x,,,,,,,,,,
aws account,,,,,,,,,,,,
,,,,,,,,,,,,
network,VPC,,,,x,x,,,,,,
network,Subnet,,,,x,x,,,,,,
network,Hosted zone (root domain),,,,x,x,,,,,,
network,Route53,,,,x,x,,,,,,
network,1 ALB for A-record,x,,,,,x,,,,,skal vi ha 1 alb for mangen applikasjonar?
network,/health for ALB target group,x,,,,,x,,,,,"Defaults to / today, should have sane default"
network,EC2 target group,,,,x,x,,,,,,
network,Auto-approval of new subdomains,x,,,,,,,,,,
network,Unique CIDR blocks per account?,x,,,,,,,,,,Do we need this? Pro: we can link VPCs easier if need. Can assign block to account from a list
,,,,,,,,,,,,
containers,ECS Cluster,,,,x,x,,,,,,
containers,Github action for updating task definition,x,,,x,,,,,,,
containers,Recommended container storage location: ECR,x,,,x,,,,,,,"ECR, github, ??"
containers,minimal reference-app w/database,x,,,x,,,,,,,should be a part of golden path setup
containers,Service auto-scaling configuration,x,,,,,,,,,,Have a default policy for auto-scaling based on CPU? To show how it is done?
containers,Many applications w/1 VPC/ALB,x,,,x,,,,,,,
containers,CI/CD toolchain / GitOps - oppdaterar terraform repo,x,,,x,,,,,,,"Is it possible to run in Fargate, to avoid giving too much permissions for a Github Action? Or should we use wiz.io ?"
,,,,,,,,,,,,
observability,Cloudwatch + Grafana?,x,,,,,x,,,,,Managed Grafana not in Stockholm yet
observability,Cloudwatch application logs,x,,,x,,,,,,,Documentation on how to use the logs
observability,Metrics for use of golden path,x,,,x,,,,,,,
observability,Deploy metrics,x,,,x,,,,,,,Oppsett fra Endre?
observability,Metrics: Cloudwatch or Prometheus?,x,,,,,,x,,,,
observability,Alerts: Cloudwatch or Grafana?,x,,,,,,x,,,,
observability,Tracing - X-ray?,x,,,,,,x?,x,,,
observability,Application Logging in ECS Which strategy?,x,,,x,,,,,,,
observability,NAT gateway logs,x,,,,,,x,,,,https://docs.aws.amazon.com/vpc/latest/userguide/vpc-nat-gateway-cloudwatch.html
observability,VPC Flow logs,x,,,,,,x,,,,https://docs.aws.amazon.com/vpc/latest/userguide/flow-logs.html
,,x,,,,,,,,,,
,,,,,,,,,,,,
database,Storage: Aurora vs serverless?,x,,,x,,x,,,,,currently serverless
database,Configuration for more than 1 database instance?,x,,,,,,,,,,write & read?
database,Migrate to aurora from old database - Runbook heller ,x,,,,,x,,,,,Not sure if V1: Consider using existing RDS to save time for now: https://docs.google.com/document/d/13orKKnr8tvTK1V30UaCPdSs5s-XLyGmeHuniSXNqx9k/edit#heading=h.zcq8y1fge9zj
database,Connect from localhost - doc on how to ,x,,,x,,,,,,,We know of one team which does this extensively.
database,Security group for application,x,,,x,,,,,,,Missing inbound/outbound rules today
database,Example alarm bundled with golden path?,x,,,,,,,,,,A simple CPU alarm
database,"Enable ""performance insight"" ",,,,x,,,,,,,free tier have 7 days logs
database,schema migration,x,,,,,,,,,,Best practice - in CI/CD? How to deal with? Good point for documentation. Maybe have in reference-app?
,,,,,,,,,,,,
Div,"Testing (end to end, like Nightly for Okctl)",x,,,,,x,,,,,Idea: Use Cypress to run proper end 2 end test.
Div,IPv6,x,,,x,,,,,,,
Div,"Golden path: linting, tfsec etc",x,,,,,,,,,,
Div,Golden path: rename bootstrap to remote_state,,,,x,,,,,,,
Div,Golden path: rename environment to project?,x,,,,,,,,,,Discuss
Div,Golden path: static site module (S3),x,,,,,,,,,,
Div,Security groups on all points where data flows,x,,,x,,x,,,,,
Div,"Golden path: Default alerts, like for instance downtime.",x,,,,,,,,,,"We can use Grafana, Cloudwatch, and/or Slack. Also see Better Uptime."
Div,QA of Terraform config (Checkov),x,,,,,,x,,,,Check out if we want this or something similar.
Div,Encrypted remote state,x,,,x,,x,,,,,"I just saw that Endre used encrypted remote stote, and Golden Path doesn't. We probably should I guess? See https://github.com/oslokommune/origo-aws-iac/blob/main/teknologi-dev/bootstrap/remote-state.tf"
Div,ok script,x,,,,,,,,,,
Div,Team kjøremiljø - opplæring på nye komponent,x,,,,,,,,,,Teamet må oppdatere kunnskap på riggen vi skal levere
,,,,,,,,,,,,
documentation,CMS - setup and deploy,x,,,,,,,,,,
documentation,How to setup golden path and delete whole/parts,x,,,x,,,,,,,Should get reference-app up and running automaticly when bootstrapping app
documentation,Migrate app & db from existing VPC to new VPC - how to migrate parts first,x,,,,,,,,,,
documentation,What does golden path give you? Drawings and overview of components,x,,,x,,,,,,,WHY we have chosen the different components
documentation,"Best practice for high availability (ECS config, replicas, NAT gateways, guidelines for how to write applications, etc)",x,,,,,x,,,,,
documentation,Containers: ECS-CLI. Setup and follow logs,x,,,x,,,,,,,https://docs.aws.amazon.com/AmazonECS/latest/developerguide/ecs-developer-tools.html
documentation,RDS: Introduction setup and considerations,x,,,,,,,,,,
documentation,RDS: How to connect from localhost,x,,,x,,,,,,,
documentation,RDS: how to rotate passwords,x,,,,,,,,,,https://docs.aws.amazon.com/AmazonRDS/latest/AuroraUserGuide/Overview.Encryption.Keys.html
documentation,RDS: backup/restore strategy Restoring example,x,,,,,,,,,,
documentation,RDS: parameter group for instances,x,,,,,,,,,,
documentation,RDS: cluster parameter group,x,,,,,,,,,,
documentation,RDS: upgrade strategy. Minor version upgrade auto upgrade,x,,,,,,,,,,
documentation,RDS: error logs - how to configure and how to debug local,x,,,,,,,,,,
documentation,RDS: alarms - how to configure and how to use,x,,,,,,,,,,
documentation,"Security: network, IAM etc on what you need to think about. Explicit rules",x,,,,,,,,,,
documentation,Better Uptime: best practice and setup,x,,,,,,,,,,
documentation,Health endpoint for ELB target group,x,,,,,,,,,,
documentation,Slack integration for alerts,x,,,,,,,,,,
documentation,Scaling: Multi-AZs & region for RDS & Application,x,,,,,,,,,,
documentation,ECS: how to run scheduled tasks,x,,,,,,,,,,
documentation,"VPC: how to configure, sane defaults, sharing with other account",x,,,,,,,,,,
documentation,"VPC: IPv4, IPv6, how to choose IP blocks",x,,,,,,,,,,
documentation,VPC: How to debug components in your VPC,x,,,,,,,,,,
documentation,VPC: subnets - what are the different subnets for?,x,,,,,,,,,,
documentation,Certificates: update/expiry handling,x,,,,,,,,,,
documentation,WAF/Shield,x,,,,,,,,,,
documentation,Logging: How to configure Logback?,x,,,,,,,,,,
documentation,Metrics: How to set up metrics for my application?,x,,,,,,,,,,
documentation,"Metrics: Document which metrics are the most relevant. And which datasources to use. Examples: Incoming requests count, response time, error rate.",x,,,,,,,,,,
,,,,,,,,,,,,
research,Terraform Enterprise  &&  Terraform cloud,,repo: kjoremiljo-admin-tasks,,,,,,,,,Evt spacelift.io